{
  "schemaVersion": "1.0",
  "runId": "run-1790506596597-trdssg",
  "mode": "live",
  "subjectDigest": "098de04af3cff188ca0c8e488678471ee3575a8e94cc76c5c95ee8c7d5de7c28",
  "scannerVersion": "0.1.0",
  "policyDigest": "9ac90e2e12d858d260abc60195484dc04c217231ce16e9b11b1899d9fcb3b46c",
  "collectionStatus": "complete",
  "incompleteReasons": [],
  "packages": [
    {
      "name": "ms",
      "version": "2.1.3",
      "previousVersion": "2.1.2",
      "location": "node_modules/ms",
      "changeType": "changed",
      "isDirect": true,
      "isDev": false,
      "isOptional": false,
      "resolved": "https://registry.npmjs.org/ms/-/ms-2.1.3.tgz",
      "integrity": "sha512-6FlzubTLZG3J2a/NVCAleEhjzq5oxgHyaCU9yYXvcLsvoVaHJq/s5xXI6/XXP6tz7R9xAOtHnSO/tXtF3WRTlA==",
      "previousIntegrity": "sha512-sGkPx+VjMtmA6MX27oA4FBFELFCZZ4S4XqeGOXCv68tT+jb3vk/RyaKWP0PTKyWtmLSM0b+42MKzXi8HBZ50zA==",
      "hasInstallScript": false,
      "scripts": {
        "lint": "eslint lib/* bin/*",
        "test": "mocha tests.js",
        "precommit": "lint-staged"
      },
      "unsupported": false,
      "unsupportedReason": null,
      "provenance": {
        "publishedAt": "2020-12-08T13:54:35.223Z",
        "maintainersCount": 6,
        "repositoryUrl": "git+https://github.com/vercel/ms.git",
        "hasAttestation": true,
        "tarballUrl": "https://registry.npmjs.org/ms/-/ms-2.1.3.tgz",
        "isSynthetic": false
      }
    },
    {
      "name": "picocolors",
      "version": "1.1.1",
      "previousVersion": null,
      "location": "node_modules/picocolors",
      "changeType": "added",
      "isDirect": true,
      "isDev": false,
      "isOptional": false,
      "resolved": "https://registry.npmjs.org/picocolors/-/picocolors-1.1.1.tgz",
      "integrity": "sha512-xceH2snhtb5M9liqDsmEw56le376mTZkEX/jEb/RxNFyegNul7eNslCXP9FDj/Lcu0X8KEyMceP2ntpaHrDEVA==",
      "previousIntegrity": null,
      "hasInstallScript": false,
      "scripts": {},
      "unsupported": false,
      "unsupportedReason": null,
      "provenance": {
        "publishedAt": "2024-10-16T18:20:03.921Z",
        "maintainersCount": 1,
        "repositoryUrl": "git+https://github.com/alexeyraspopov/picocolors.git",
        "hasAttestation": true,
        "tarballUrl": "https://registry.npmjs.org/picocolors/-/picocolors-1.1.1.tgz",
        "isSynthetic": false
      }
    }
  ],
  "observations": [],
  "unknowns": [
    "Runtime dynamic effects were not executed or observed.",
    "Full cryptographic npm provenance was not verified (adapter extension pending)."
  ],
  "sources": [
    {
      "sourceType": "live",
      "pathOrUrl": "https://registry.npmjs.org/ms/-/ms-2.1.3.tgz",
      "retrievalTime": "2026-09-27T10:56:36.722Z",
      "contentDigest": "sha512-6FlzubTLZG3J2a/NVCAleEhjzq5oxgHyaCU9yYXvcLsvoVaHJq/s5xXI6/XXP6tz7R9xAOtHnSO/tXtF3WRTlA=="
    },
    {
      "sourceType": "live",
      "pathOrUrl": "https://registry.npmjs.org/ms",
      "retrievalTime": "2026-09-27T10:56:36.723Z",
      "contentDigest": "sha512-6FlzubTLZG3J2a/NVCAleEhjzq5oxgHyaCU9yYXvcLsvoVaHJq/s5xXI6/XXP6tz7R9xAOtHnSO/tXtF3WRTlA=="
    },
    {
      "sourceType": "live",
      "pathOrUrl": "https://registry.npmjs.org/picocolors/-/picocolors-1.1.1.tgz",
      "retrievalTime": "2026-09-27T10:56:36.784Z",
      "contentDigest": "sha512-xceH2snhtb5M9liqDsmEw56le376mTZkEX/jEb/RxNFyegNul7eNslCXP9FDj/Lcu0X8KEyMceP2ntpaHrDEVA=="
    },
    {
      "sourceType": "live",
      "pathOrUrl": "https://registry.npmjs.org/picocolors",
      "retrievalTime": "2026-09-27T10:56:36.784Z",
      "contentDigest": "sha512-xceH2snhtb5M9liqDsmEw56le376mTZkEX/jEb/RxNFyegNul7eNslCXP9FDj/Lcu0X8KEyMceP2ntpaHrDEVA=="
    }
  ]
}